{
  "schemaVersion": "1.0",
  "projectId": "shell-agent-wm-001",
  "createdAt": "2026-07-01T00:00:00Z",
  "updatedAt": "2026-07-23T18:00:00Z",
  "perPhase": {
    "maxTokens": 200000,
    "maxSubagentSpawns": 10
  },
  "project": {
    "maxTokensTotal": 2000000
  },
  "onExceed": "pause",
  "killSwitch": {
    "consecutiveReworks": 3,
    "budgetBurnRate": 0.9,
    "tlaReworks": 3
  }
}
